Title,Text,Link,Length,Summary,Score
Is this the same subreddit whose manifesto a a year ago was shorting the S&P 500?,"Look, I've been around here for a while. I do not participate but rather love to sit in the bleachers. And if my memory does not fail, this subreddit was hell bent, practically praying, for the American economy to fail about a year ago. Shorting SPY was pretty much the only thing that anyone talked about here. 

I'm not here to point out hypocrisy because I don't care what y'all do with your money. But the narrative needs to change. All this ""fuck the hedge funds"" and ""we're the American people / power to retail buyers"" is bullshit. 

The power and essence of WSB has and always will be the DEATH OF THE STATUS QUO. Don't hide behind some moral wall of superiority like you're the good guy. We're not here to be the good guys, never were. We're here to tear down the institutions and systems that are seemingly too big to touch. We briefly profited off of the failing of the American economy and today we profit off of the arrogance of elites that do the same as us. Fuck Melvin, fuck Citron, but find a new slant.",https://www.reddit.com/r/wallstreetbets/comments/l6zfgi/is_this_the_same_subreddit_whose_manifesto_a_a/,198,"Reddit was hell bent, practically praying, for the American economy to fail about a year ago. Shorting SPY was pretty much the only thing that anyone talked about on Reddit at the time. The power and essence of WSB has and always will be the DEATH of the Status quo.",97
"Write your Senator about WallStreet messing with retail investors, shutting down platforms and changing trading rules!","Write your Senators an email today about how WallStreet is trying to change the rules to save themselves and hurt retail investors trading stocks like GME!

Scroll down to find your Senator and click to their page for email contact. https://www.senate.gov/senators/index.htm

For decades we have dealt with high frequency trading (60% of all trades per day is HFT) manipulating the retail investor letting Wall Street win. Now they want to stop and change the rules because they are losing? Not fair. Let your Senators know you are the voter and big Wall Street needs to be held accountable for shutting down apps on 1/27 and today as well as changing the trading rules to suit their needs when they start to lose money.",https://www.reddit.com/r/wallstreetbets/comments/l6zdxz/write_your_senator_about_wallstreet_messing_with/,130,"""Big Wall Street needs to be held accountable for shutting down apps on 1/27 and today as well as changing the trading rules to suit their needs when they start to lose money,"" says GME co-founder Carl Icahn, CEO of GME.",100
QuantumScape (QS) is the next wave,"Well done, Redditors in successfully driving up GameStop! We've stuck it to the big Wall Street funds. GameStop has pretty much run its course at this point, so it's time to create the next big wave and keep this momentum going!

QuantumScape (QS) has the most advanced battery technology in the world right now and is well poised to take huge market share in the electric car battery industry. It's backed by Volkswagen, which is the world's largest car manufacturer, and Bill Gates, who knows a thing or two about technology. With the whole world focused on electric cars, stocks like Tesla have skyrocketed in valuation. QuantumScape is an opportunity to get into the electric car market with a young company that is just starting its rise. Let's use those GameStop returns and plow them into a new wave!",https://www.reddit.com/r/wallstreetbets/comments/l6zdt8/quantumscape_qs_is_the_next_wave/,144,"QuantumScape has the most advanced battery technology in the world right now, and is poised to take market share in the electric car industry.",
Did Robinhood catch you with your pants down? Then LEAVE,"For you inbreds that don't know how to use google, here's a link on how to transfer your account to a different brokerage. 

[https://robinhood.com/us/en/support/articles/transfer-stocks-out-of-your-robinhood-account/](https://robinhood.com/us/en/support/articles/transfer-stocks-out-of-your-robinhood-account/)

&#x200B;

It's a shame what they've done, considering they have one of the best mobile UI's, but what they've done cannot be forgiven. Leave that dumpster fire of a company and pursue greater tendies.",https://www.reddit.com/r/wallstreetbets/comments/l6zdsn/did_robinhood_catch_you_with_your_pants_down_then/,91,"For you inbreds that don't know how to use google, here's a link on how to transfer your account to a different brokerage.",
First ever posts for the culture,"I’ve only ever lurked Reddit for years but this time that changes. I took as much as I possibly could and I’m waiting for opening tomorrow morning to GIVE TO THE CAUSE. I’m scared shitless but I will FIGHT to dick those greedy bastards down to the ground.

I’m in it for the long haul. I’m in this with all of you just as you are for me. I’m buying my ticket TO THE MOON 🚀

Hopefully it's not taken down for any reason and sorry mods if I'm breaking any rules, feel free to remove this.",https://www.reddit.com/r/wallstreetbets/comments/l6zdqk/first_ever_posts_for_the_culture/,104,"I've only ever lurked Reddit for years but this time that changes. I'm scared but I will fight those greedy bastards down to the ground, he writes. ""I'm in this with all of you just as you are for me.""",88
Short Stock Traders are just shooting themselves in the foot,"Using their underhanded tactics to try to screw over the average joe is only backfiring. Like the hulk, Every time they try to stop us we get angrier and our 💎 👐 get stronger. Theyre do used to their billionaire buddiee who as soon as they got red they sell and move on, they arent used to us autists who even if we lose everything we got from being broke to still being broke. 
At this point, screw Wall St and screw robinhood and screw anyone who thinks that we dont deserve the same opportunities to make money as the top 1%. 
They put themselves into this situation by shorting the stocks to more than 100% of available stocks, and keep making it worse! Power to the playere and ill see you all on Pluto 🚀🚀🚀

Also if you havent seen it and have anyone you know who say any of the CNBC bullshit, I would reccomend this video by Louis Rossmann to show them how this ill got started https://youtu.be/4EUbJcGoYQ4",https://www.reddit.com/r/wallstreetbets/comments/l6zdkn/short_stock_traders_are_just_shooting_themselves/,171,CNBC's underhanded tactics to try to screw over the average joe is only backfiring. Every time they try to stop us we get angrier and our autists get stronger. Power to the playere and ill see you all on Pluto.,88
Apparently I can’t buy any stocks period from Robinhood or stash,That’s upsetting that Robin Hood decided not to let me. Buy any stocks that I purchased last night then on top of that stash decide to mysteriously do an update when you can’t buy any stocks either from them is any of the day trading stocks allowing you to buy any stocks at all and while I’m at it how we decide what’s the next target so we can go ahead and dump money into that before Robin Hood stops it again yeah they’re right about the name Robin Hood the Robin from us well we know how to play the game,https://www.reddit.com/r/wallstreetbets/comments/l6zdkj/apparently_i_cant_buy_any_stocks_period_from/,107,You can't buy any of the day trading stocks allowing you to buy any stocks at all. Robin Hood stops you from buying any stocks either from them or from the list of companies that are open for day trading on Stocksquiz.co.uk.,85
RH alternative for Europeans,"Hey guys, I've been following the GME movement from Spain and I just wanted to share that I just placed an order on eToro. It took a while to process the order but it ended up working just fine.  


Hope this info helps you if you want to be part of this and you are based in Europe. Also, I saw someone asking where to buy fractions of a stock; you can do it in eToro as well.  


\*\*I'm not recommending this platform, I'm just sharing my experience with it as an alternative to RH. RH is not available in Europe\*\*",https://www.reddit.com/r/wallstreetbets/comments/l6zdka/rh_alternative_for_europeans/,104,"I'm not recommending this platform, I'm just sharing my experience with it as an alternative to RH. RH is not available in Europe, says the Spanish-based GME founder and GME activist. ""It took a while to process the order but it ended up working just fine,"" he says.",96
BOOSTING THIS COMPLAINT SUMMARY FROM u/phillycheese25,"REPORT ROBINHOOD TO THE SEC:  https://www.sec.gov/oiea/Complaint.html  

Feel free to use my complaint summary if you agree:  “Robinhood has gone against the fiduciary duty of its market client base, along with his company’s motto of “democratizing finance for all” by participating in market manipulation. Robinhood has banned the purchase of several NYSE listed equities securities including GME, AMC, BB, and NOK. This is a mockery of the United States’ foundational characteristic of free markets. Clearly, Robinhood, along with other similar broker dealers, have no interest in the free market or for individual investors. Rather, they serve the interests of hedge fund corporations who have most likely persuaded these firms to engage in market manipulation in order to mitigate losses enacted by short selling. An investigation into Robinhood and similar broker/dealers, along with the hedge funds who have recently lost profits due to their negligent short positions in the stocks mentioned above should take place in order to preserve what’s left of the American democracy.”",https://www.reddit.com/r/wallstreetbets/comments/l6zdk3/boosting_this_complaint_summary_from/,172,"Robinhood has banned the purchase of several NYSE listed equities securities including GME, AMC, BB, and NOK. This is a mockery of the U.S.'s foundational characteristic of free markets, writes Michael Wolraich for his complaint to the SEC.",99
NOK will FLY @ 11:30 hours,"Helsinki (Finland) stock market will close at 11:30 (5:30/17:30 local time).  


Take a look at yesterdays graph. As soon as the Helsinki market closed, NOK ran. That is because there is no point of reference at the time.

https://preview.redd.it/2t5ewmmib3e61.png?width=1515&format=png&auto=webp&s=395a5d98e45ec7a980f1b3587b14c1e0da459e8c

What is happening now, is that the Helsinki SP will constantly work as an anchor for any gains in the US stock, making it super hard to move.",https://www.reddit.com/r/wallstreetbets/comments/l6zg95/nok_will_fly_1130_hours/,84,"The Helsinki SP will work as an anchor for any gains in the US stock, making it super hard to move in either direction at the same time because there is no point of reference.",100
"I know nothing about investing, but I love what you all are doing. how do I get in on GME and help my friends do the same? I honestly have no idea where to start","you all are amazing!! as a frequent redditor, it really warms my heart to see this movement coming from here🖤 reddit can be a dark place in a lot of ways, but finally here’s some good!!

I’d love to get in on this, but I’m seriously ignorant about anything having to do with investing. all I knew about was the Robinhood app, but I’m having trouble using it. I apologize for being such a newb ahhh. but any guidance would be seriously appreciated!! I really want to be able to help my friends join the movement too, as they are in my boat right now when it comes to knowledge about stonnnks

thanks so much!",https://www.reddit.com/r/wallstreetbets/comments/l6zf70/i_know_nothing_about_investing_but_i_love_what/,119,"I'm seriously ignorant about anything having to do with investing, all I knew about was the Robinhood app, but I'm having trouble using it. I apologize for being such a newb but any guidance would be seriously appreciated! said one redditor.",87
"You absolute heroes, I cannot believe it","Slowly this year I took a deeper look into the market, I ordered books, read charts, ran spreadsheets and was making a slow and safe profit over the months. I was looking forward to learning the lingo and trying my best to make a good side hustle. 

I read news and posts and try to articulate how this has come to be, and the only way is to completely toss human greed out of the window and trust your fellow redditors. It's quite astounding and I've grown a very wholesome respect for each and every one of you. 

Before, I just came here to read silly stories, hype myself by finding people who had made more money than my salary x10 in just an option, how retarded.

I tried to explain to my (not so market savvy) friends the extent of what's happening here, and how it came to be, and most importantly how proud I am. And as I do so my largest holding starts to gain traction on WSB.

I am a Canadian male, 22, I was born in British Columbia and was taken away from my mother by child protective services, she had an issue with alcohol and heroin and it was hinted that I might've had some in my system when I was born.

Child protective sent me to live with my father, who was his own cup of tea. To summarize, my father was a drug dealer and I was his accident baby, he had not the experience or will to raise me and I was neglected my early years of life. I assume he hadn't worked out with my mother as they were just having a fling.

My grandmother, fathers side, set me up an air mattress in her kitchen when I was four years old and that was when I unofficially moved out. There was lots of restless nights at my father's and id often catch the school bus with him still being awake and drunk from the night before. There were many strangers sleeping on my bed over the years.

My family and I had always had problems with poverty, my father's money was taken when he went to jail, Ive never really met my mother, and I burned through my single grandmothers savings by needing food and school supplies.

I went to college in 2017 for mechanical engineering,  I really liked it and got great grades. I met the first woman I've really, really liked there, we got along perfect. 

Nearing the end of my second year she grew distant and ended up cheating on me with someone in my program, I dropped out and refused to see her again. I was on OSAP student loan program which was tanked by Doug Ford, I had to pay it all back.

Since then I have been working as a cleaner at my local courthouse, I save money in my brokerage, buy groceries for granny, and am trying to pay off her debt (abt. 9000CAD).  I don't talk to either of my parents, obviously. But I am worried because she is now 71 and showing signs of mental decline. 

I was planning on going back to school, university (Bachelor of Engineering (software)/Masters of Business administration) in 2023 or 2024 if I had saved up enough to reasonably support myself, continue work, and go to school.

I sit here watching gamestop, dumbfounded, and here you are boosting my largest holding now killing my shorts. If this really works out for me I can finish school before I am thirty, and I can pay off grannys debt sooner than that even.
If this works out I swear I'll come back with my degree (and proof) and I'll train you retards with the knowledge I've absorbed. Mark my words. I really feel like I could be pulled out of poverty along with my future right now. And I  owe it all to you.

I'm crossing my fingers, I've been long for a while and do not plan on selling my little nest-bags I have here. I have 1746 at .585 average in my personal, and I have 4218 at a .61 average in my tfsa. God help me. As I write this message we are booming and I'm so proud. I hold 90% of my portfolios in SNDL. Could you please lift our float? If not just tell me what I have to do, you have all earned my diamond hands on your side.",https://www.reddit.com/r/wallstreetbets/comments/l6zf4i/you_absolute_heroes_i_cannot_believe_it/,765,"I, Canadian male, 22, was on OSAP student loan program which was tanked by Doug Ford, I had to pay it all back. I don't talk to either of my parents, obviously. But I am worried because she is now 71 and showing signs of mental decline.",89
They can't stop us.,"ROBINHOOD DOWN, NOT ALLOWING ANYONE TO BUY GME, BUT THEY ARE ALLOWED TO SELL IT. YOU'D THINK THIS WOULD FORCE THE PRICE TO GO DOWN RIGHT? WRONG! 

WE DON'T PANIC SELL. HOLD STRONG BOYS. 75% OF OUR COMMUNITY IS ROBINHOODERS. ROBINHOOD SHOWED THEIR TRUE COLORS TODAY! THE 25% OF US THAT TRADE ON DIFFERENT PLATFORMS BOUGHT UP BIG FOR US.

THE REST OF US 75% NEED TO SWITCH TO A DIFFERENT BROKERAGE. I JUST OPENED A FIDELITY ACCOUNT THIS MORNING.... 

JUST WAIT UNTIL WE CAN ACTUALLY START BUYING TOO.... TO THE MOON WE GO🚀🚀🚀 THIS ALSO SHOWS HOW BIG OUR REACH IS, BECAUSE WITH SO MUCH PUBLICITY WE PROB BUT ROOKIE WSBers TO BUY THAT ARE ON DIF PLATFORMS.

GOOD SHIT. WE DIDN'T START THIS WAR BUT YOU'RE DAMN RIGHT WELL FINISH IT.",https://www.reddit.com/r/wallstreetbets/comments/l6zf4h/they_cant_stop_us/,137,"We DIDN'T START THIS WAR, BUT YOU'RE DAMN RIGHT WELL FINISH IT. ROBINHOOD SHOWED THEIR TRUE COLOR(S) TODAY! THE 25% OF US THAT TRADE ON DIFFERENT PLATFORMS BOUGHT UP BIG FOR US.",96
SEC if you’re reading this do your damn job instead of harassing the poor,"If these guys want to manipulate the market let’s manipulate a stock everyday. Jan 28th: BB🚀🚀 to me this is more than just stocks now I’m tired of the rich being so unjust to us lower class citizens and valuing us for our ability to make money instead of valuing are existence. Let’s prove to them that making money is easy, you just gotta come together and blow a stock up BB to 100 today!!",https://www.reddit.com/r/wallstreetbets/comments/l6zezd/sec_if_youre_reading_this_do_your_damn_job/,78,I'm tired of the rich being so unjust to us lower class citizens and valuing us for our ability to make money instead of valuing are existence. Let's come together and blow a stock up BB to 100 today!!,72
Destroy Robinhood,I placed $650 into AMC and Nokia last night and woke up exactly when the market opened this morning at 9:30. Just to see that robinhood canceled my orders for me. This is market manipulation they will pay for this. For those who have AMC and Nokia pleasssse HOLD 🙏🏾 they’re trying to stop the rest of us but they can’t stop the ones already on the inside we’re fighting Wall Street now 😬,https://www.reddit.com/r/wallstreetbets/comments/l6zey5/destroy_robinhood/,76,“I placed $650 into AMC and Nokia last night and woke up exactly when the market opened this morning at 9:30. Just to see that robinhood canceled my orders for me. This is market manipulation they will pay for this.”.,97
fuck wallstreet & melvin,"Citadel is a hedge fund that owns Melvin Capital Management.

Melvin is a $GME short seller predicted to lose BILLIONS due to the people taking the free market back.

Citadel owns the app Robinhood.

Citadel banned purchases of new $GME shares on RH.

Market manipulation.

Citadel isn’t a majority owner of RH, but they DO pay RH a hefty figure to the app for consumer data. On top of the money paid to bail out Melvin. 

All they have to do is threaten to pull that money for data from RH and RH pulls new share purchases of $GME. 

It’s wild.",https://www.reddit.com/r/wallstreetbets/comments/l6zeuv/fuck_wallstreet_melvin/,103,"Citadel is a hedge fund that owns Melvin Capital Management. Melvin was predicted to lose billions due to the people taking the free market back. Citadel isn't a majority owner of RH, but they do pay RH a hefty figure for their user data.",100
"EVERYONE, 💎🙌💎🙌💎🙌💎🙌💎🙌","WHATEVER STOCK YOU ARE IN

#DO NOT SELL

I don’t give a fuck if your broker comes to your fucking house and breaks your fucking thumbs, **DO NOT FUCKING SELL!**

u/deepfuckingvalue was down way more and fucking clenched his cheeks together and held until his finger tips were encrusted with fucking diamond flakes. And guess what!? **HE IS STILL FUCKING IN!**

Don’t be a 📄 🌈 🐻!


We will all go to Mars!🚀🚀🚀🚀🚀🚀🚀🚀🚀🚀🚀🚀🚀🚀🚀🚀🚀🚀🚀🚀🚀🚀🚀🚀🚀🚀🚀🚀🚀🚀🚀🚀🚀🚀🚀🚀🚀🚀🚀🚀🚀🚀🚀🚀",https://www.reddit.com/r/wallstreetbets/comments/l6zero/everyone/,73,"I don't care if your broker comes to your house and breaks your thumbs, **DO NOT SELL!**. u/deepfuckingvalue was down way more and clenched his cheeks together and held until his finger tips were encrusted with diamond flakes.",91
Most Shorted Stocks Update: Here Come The Microcaps,"Saddle Ranch Media (**SRMX**) - whose stock costs *one-hundredth of a nickel* (probably for good reasons) and which ""is a diversified media and entertainment company operating three divisions: Saddle Ranch Digital, Saddle Ranch Film, and Saddle Ranch TV"", and KYN Capital Group (**KYNC**) - a ""capital-finance leasing company""  and both of which are pink sheet, microcap companies - the first has a market cap of just $9MM and, according to Bloomberg, ***a short-to-float ratio of 129%,*** or just below that of Gamespot... 

*Processing img dorl94c1b3e61...*",https://www.reddit.com/r/wallstreetbets/comments/l6zenv/most_shorted_stocks_update_here_come_the_microcaps/,86,"Saddle Ranch Media (**SRMX) and KYN Capital Group (**KYNC) are two very small, microcap companies - both of which are listed on the NYSE under the ticker symbols ""SRMX"" and ""KYNC"", respectively.",84
Big boys are counter attacking.,"...the downturn will and has started😰.  The WStreet folks with their highly sophisticated AI and quant systems and big business/political influence have analyzed the situation and will counter attack.  Beware.  Remember the lesson of ‘The charge of the light brigade’.  Heroic intent, but a complete massacre for those trying to outwit those with vastly superior experience and $’s firepower.  The element of surprise is over.  Don’t lose your shirt!",https://www.reddit.com/r/wallstreetbets/comments/l6zent/big_boys_are_counter_attacking/,71,"The element of surprise is over. The WStreet folks with their highly sophisticated AI and quant systems and big business/political influence have analyzed the situation and will counter attack. Remember the lesson of 'The charge of the light brigade',. Heroic intent, but a complete massacre.",70
🚀 🚀 WE WILL BE VICTORIOUS! 🚀 🚀 HOOOOOOOOOOOLD 🚀🚀,"&#x200B;

https://preview.redd.it/gz0uikfcb3e61.jpg?width=275&format=pjpg&auto=webp&s=eda3c3d841d905d0877e78a1bc2d15b18ba476f2

The paranoia is in bloom  
The P.R. transmissions will resume  
They'll try to push drugs, keep us all dumbed down  
And hope that we will never see the truth around, so come on

Another promise, another scene, another  
Packaged lie to keep us trapped in greed with all the  
Green belts wrapped around our minds and endless  
Red tape to keep the truth confined, so come on

They will not force us  
And they will stop degrading us  
And they will not control us  
We will be victorious, so come on

Interchanging mind control  
Come let the revolution take its toll  
If you could flick a switch and open your third eye  
You'd see that we should never be afraid to die

So come on

Rise up and take the power back  
It's time the fat cats had a heart attack  
You know that their time is coming to…

(c) Muse.",https://www.reddit.com/r/wallstreetbets/comments/l6zei0/we_will_be_victorious_hooooooooooold/,170,"The paranoia is in bloom. The P.R. transmissions will resume  - they'll try to push drugs, keep us all dumbed down. And hope that we will never see the truth around. So come on, let the revolution take its toll.",100
Silver is about to MOON $$$,"Silver is breaking out on multiple time frames, this is just the beginning. Very likely it will break all time high of $50, so you're looking at 100% gain as a very real possibility in the short term just based on technicals, who knows how high it could go with a bit of momentum from the autists. 

Charts below with my entries for proof, will be adding on pullbacks. Reverse head and shoulders pattern playing out on the daily chart, along with weekly MACD about to turn positive. This is just the beginning. First post I've made here, feel like this is the first time I really have a trade worth sharing.

&#x200B;

*Processing img 48q6dmcqa3e61...*

&#x200B;

https://preview.redd.it/9ovii1ifa3e61.png?width=794&format=png&auto=webp&s=37840c364062c54e76031b12c216891bfe679680

Weekly Chart, MACD indicator close to turning positive.

&#x200B;

Enjoy Retards..",https://www.reddit.com/r/wallstreetbets/comments/l6zecw/silver_is_about_to_moon/,144,"Silver is breaking out on multiple time frames, this is just the beginning. Very likely it will break all time high of $50, so you're looking at 100% gain as a very real possibility in the short term. I'll be adding on pullbacks.",83
