Title,Text,Link,Length,Summary,Score
Tonight showed how much the average retail investor can do,"What seemed like a coordinated attack on the discord and sub to silence us and momentarily drive the price down after hours is all the proof I personally need to see to know how much higher this can rise in the coming days. They are scared. 

The shorts have only themselves to blame. They were given life lines and extra capital to escape their positions. But instead they use that money and opportunity to double down. 

They call us names and make it seem like we are bandits, when in reality we are your brothers and sisters, aunts and uncles and so on. There is nothing malicious about liking a stock and buying and holding it. 

In fact, CNBC and other outlets encouraged the young generation to start investing and tell us the stock market is the greatest creation of wealth possible. 

But when we do, they don’t like us getting it right. They are the pool sharks at the table and they just want us to play to get our money. 

Hold strong in your convictions and if you’re in a certain stock remember why and do not let emotions take over. When you do, they win and you lose. And trust me when I say, we do not get a bail out. 

Hold strong!

Positions: 160 shares GME",https://www.reddit.com/r/wallstreetbets/comments/l6lc2r/tonight_showed_how_much_the_average_retail/,222,"""What appeared like a facilitated assault on the strife and sub to hush us and quickly drive the cost down after hours is all the confirmation I actually got to see to know how much higher this may rise"". The shorts have, as it were themselves, to a fault. They were given lifelines and additional capital to elude their positions.",100
"If we all come up with a dollar or two, we could get the best securities lawyers on retainer for a class action if the SEC pulls shenanigans","The Age of the Retail is upon us.

The brokers have given us commission-free trading. Reddit, twitter, etc. have given us a collective hive mind where ideas can be nurtured, critiqued, developed, distributed, and acted upon in concert.

However, the government, hedge funds, brokers, et. al. still practice their dirty tricks to protect their own. We should fear the systematic risk of cronyism within the halls of government and Wall Street to put the brakes on our profit making, which is our lawful American right.

Should the SEC illegally or unjustly intervene on behalf of their friends (who so often reward government poodle regulators with lucrative jobs after leaving civil service), we will need to find a large law firm that specializes in securities and class actions and is willing to setup a trust account where you give your name, nominal retainer fee, and proof that you owned $GME to establish standing in a suit.

edit: Align incentives.

edit2: To those who misunderstand, this isn't about hiring a defense attorney, this is about holding government regulators accountable in federal court if they chose to illegally or unjustly injure GME holders. That can only be done if GME holders have representation. 

Disclosure: We are individual investors that like the stock. Each WSB user acts of his own accord with regards to his market activity. Fearing illegal or unjust SEC action and hiring counsel is our American right, as is our Freedom of Association.",https://www.reddit.com/r/wallstreetbets/comments/l6l5i5/if_we_all_come_up_with_a_dollar_or_two_we_could/,244,"Reddit, Twitter, etc. have given us a collective hive intellect where thoughts can be sustained, critiqued, created, disseminated, and acted upon in concert. Government, support reserves, brokers, et al. still hone their messy traps to ensure their possess. ",99
"William Gavin on WSB ""the retailers are vulnerable""","I felt like I needed to get this off my chest. I've lurked this sub for over a year. Throughout the pandemic, this subreddit and the discord have been my home. I turned $800 into $20k, not the most money, but the most fun I've had in some time. You guys have made me laugh. You guys have made me cry with bad options plays. You guys have made a lonely time less lonely. I've never been more excited to see others make money while I watched on the side. 

Today, like us all, I've been reading through news. William Gavin, Secretary of the Commonwealth of Massachusetts, told Barron's we should halt Gamestop for a month to let it cool down because ""small and unsophisticated investors are probably going to get hurt by this.”

The outrage, to attempt to save big money while saying its to protect us. He said we are vulnerable. He said we are too ""unsophisticated"" to understand our risks. He said that shorts at least are sophisticated. Its so stupid its laughable. As if we are simply children mashing buttons. 

We are adults, with crayons.

So Bill, please tell us how vulnerable we are tomorrow. 


“I think the little guys you describe are probably the ones most likely to get hurt,” he said. “Those that are more sophisticated—who might be shorting—they may get hurt, but they’re more sophisticated. They probably understand the risk they’re taking.”


EDIT: Please dont upvote. Just hit 6.9k Karma. 

EDIT 2: Too late, karma to the moon.",https://www.reddit.com/r/wallstreetbets/comments/l6l2mr/william_gavin_on_wsb_the_retailers_are_vulnerable/,265,"""I turned $800 into $20k, not the foremost cash, but the foremost fun I've had in a few time"" William Gavin, Secretary of the Commonwealth of Massachusetts, told Barron's we ought to end Gamestop for a month. He said that shorts at slightest are advanced. We are grown-ups, with colored pencils.",90
The WSB Index: Quantifying r/WallStreetBets ludicrous performance in 2021,"For the past few months, I've been testing a strategy that is based around discussion on WallStreetBets. I don't need to give you an introduction into what's been going on here, so I'll get right into the pretty pictures.

**Strategy**

1. Get data on previous week’s WallStreetBets discussion from Quiver Quant API.
2. Identify the five most mentioned stocks.
3. Buy those stocks at the start of the trading week, sizing positions based on how much they were talked about in proportion to each other.
4. Sell positions at the end of the trading week.
5. Repeat

**Performance**

[Performance \(Jan 1, 2020 - Jan 27, 2021\)](https://preview.redd.it/tr3ihfrxbzd61.png?width=3246&format=png&auto=webp&s=cffd3bfcb564265a6e8d8429c0dcf26be1c1580c)

I initially considered examining the sentiment behind discussion of different tickers and constructing a market-neutral portfolio, but decided that taking short positions sounded like some bear shit and chose to steer clear.

Below is a visualization showing what the portfolio looked like every week. Note the bar sizes increasing and decreasing depending on how much capital we have to invest.

[Portfolio by Week](https://preview.redd.it/l29q1b0eczd61.png?width=3134&format=png&auto=webp&s=9d871d7b8b19159134036883adb033dcd0f45d37)

Let me know if you have any questions about the strategy and congratulations on your outstanding returns.

&#x200B;

EDIT:

Here's what performance looked like today. WSB up 67%, market down 2.5%.

https://preview.redd.it/yhpi4ieidzd61.png?width=3308&format=png&auto=webp&s=f6f6038903e8c20db0d7e2da56f5e5a8b8288a63

&#x200B;",https://www.reddit.com/r/wallstreetbets/comments/l6kzf8/the_wsb_index_quantifying_rwallstreetbets/,250,"For the past few months, I've been testing a methodology that's based around dialogue on WallStreetBets. Purchase and offer stocks based on how much they were talked about almost in the extent to each other. Below may be a visualization appearing what the portfolio looked like each week.",99
20 years from now...,"Imagine you’re sitting in your wife’s boyfriend’s kitchen 20 years from now and their ten year old kid that you’re raising walks in.

“Hey, I just watched a movie about the GameStop squeeze of 2021! Weren’t you in the stock market back then?”

His excitement tries to cut through the field of regret the memory has sparked, but it can’t. 

“I was,” you answer hesitantly. “That was a crazy time.”

“Well, did you trade it? Did you have it when it went to two thousand??”

He’s so giddy it’s almost palpable. You take a sip of coffee before answering.

“Well uh, I was, but sold my shares in the morning after they fell fifty bucks in after hours trading, at two hundred.”

You’ve never seen your son look at you like this before, and hope you’ll never have to again.

“Uh, okay.. bye..” he walks off.

You sigh, closing your eyes. 

What you wouldn’t do to change the past.



Edit: Don’t give this dumb post money, put it into GME",https://www.reddit.com/r/wallstreetbets/comments/l6kwmf/20_years_from_now/,182,"""That was an insane time,"" your child says. ""Well uh, I was, but sold my offers within the morning after they fell fifty bucks in after-hours exchanging, at two hundred."" You've never seen your child see at you like this sometime recently, and I hope you'll never need to once more.",100
Chamath Palihapitiya for President,"This is simple retards, he already publicly hinted at running for California Governor. All we have to do is spread the word and get this mans elected to Ca Governor. By that time this sub (considering the growth scale) should have enough members to swing an election vote. Hook, sinker ladies and gents, then we really take down the hedge funds. 
Note: this is super retarded and probably wont work but cool to think about.
Positions: GME 350c / AMC 2700 shares @ 4.81 and jan 20c 2022.

EDIT: P.S. : GME TO 10,000

EDIT 2: Yes, I live in California",https://www.reddit.com/r/wallstreetbets/comments/l6kqyk/chamath_palihapitiya_for_president/,101,"This often straightforward impedes, he as of now freely implied at running for California Senator. All we ought to do is spread the word and get this mans chosen to Ca Representative. Snare, sinker women and gentlemen, at that point we truly take down the fence stores.",86
We. Are. Strong. 🚀🚀,"This community has gone through many things together. Loss porn, 10000%+ gainz, and many fights where we had each other’s backs. It’s not about the money, and we all know that or else we wouldn’t pull out loans to dump into stocks we promote. It’s about community, and we are at a precipice in history that WILL DETERMINE wether we live in a society dominated by the elite, or by the PEOPLE. If we roll over and let Wall Street steal out of the pockets of hardworking Americans like yourselves, nothing will ever change. But this time, the people hold the power, and they are scared.

WE ARE A COMMUNITY. We must not let the shill news and manipulated after hours pricing get to our heads. This is a BATTLE to TAKE BACK THE POWER TO OUR FINANCIAL SYSTEM, and possibly the best thing we could do since we fucked up the gold standard.

It’s our time. Our time is now.

Go forth and 💎 👐",https://www.reddit.com/r/wallstreetbets/comments/l6kicj/we_are_strong/,169,"We are a community. We must not let the shill news and controlled after-hours estimating get to our heads. Usually a fight to require back the control to our budgetary framework, and conceivably the finest thing we might do since we broke up the gold standard.",97
Thank you moderators,"I don’t know what the future of this community is.

I do know that the moderators of this community have made it possible to make history.

More than that, it has always felt like the mods have legitimately cared about maintaining the spirit of WSB over the years even in it’s massive growth.

We will all look back on this period of our lives with a smile - even those like me with just a little bit of money - and we have the mods to thank.

***THIS IS NOT INVESTMENT ADVICE. I JUST LIKE THE STOCKS.***

Edit: Mods = 🚀",https://www.reddit.com/r/wallstreetbets/comments/l6kgq9/thank_you_moderators/,99,"""I do know that the arbitrators of this community have made it conceivable to create history,"" he composes. ""We'll all see back on this period of our lives with a grin - indeed those like me with fair a small bit of cash - and we have the mods to thank"".",100
THANK YOU MOD TEAM YOU GLORIOUS RETARDS,"I've seen this sub call you guys everything from gays to homos, and I'm too retarded to know the difference. Y'all have created and fought to preserve an amazing community on reddit despite a complete lack of proper tools to help you do so. 

It's clear our sub is getting infiltrated by boomers and bastards like fucking White Walkers. Y'ALL NEED TO KNOW WE APPRECIATE YOU FOR TRYING TO KEEP SHIT FUNCTIONAL!

FUCK wallstreet money! FUCK Melvin Capital! FUCK these 🌈🐻!!

I bet the markets tanked today as people tried to sell other assets and cover their GME asses, as we spank them with their shorts around their ankles. Fuck em!

I don't have shit to my name, but I have 17 GameStop shares I've held since $77.

WE'RE NOT BARBARIANS AT THE GATES OF WALLSTREET, WE'RE THE WARRIORS CLEANING OUT A CASTLE FULL OF ORCS!

Keep it up mods, we're not fucking leaving

Edit: Positions 
https://ibb.co/fS76Cs4
https://ibb.co/Vj4NcdG
https://ibb.co/GdGt1vF
https://ibb.co/pLVs4X5",https://www.reddit.com/r/wallstreetbets/comments/l6kcgt/thank_you_mod_team_you_glorious_retards/,181,"""I've seen this sub call you folks everything from LGBTQ, and I'm as well impeded to know the contrast. We are not barbarians at the doors of Wallstreet; we are the warriors cleaning out a castle full of orcs!",100
"What Are Your Moves Tomorrow, January 28,2021","What Are Your Moves Tomorrow, January 28, 2021

Mods we need a discussion thread REEEEEE

Your daily trading discussion thread. Please keep the shitposting to a minimum. 

^Navigate ^WSB|^We ^recommend ^best ^daily ^DD
:--|:--                                 
**DD** | [All](https://reddit.com/r/wallstreetbets/search?sort=new&restrict_sr=on&q=flair%3ADD) / [**Best Daily**](https://www.reddit.com/r/wallstreetbets/search?sort=top&q=flair%3ADD&restrict_sr=on&t=day) / [Best Weekly](https://www.reddit.com/r/wallstreetbets/search?sort=top&q=flair%3ADD&restrict_sr=on&t=week)
**Discussion** | [All](https://reddit.com/r/wallstreetbets/search?sort=new&restrict_sr=on&q=flair%3ADiscussion) / [**Best Daily**](https://www.reddit.com/r/wallstreetbets/search?sort=top&q=flair%3ADiscussion&restrict_sr=on&t=day) / [Best Weekly](https://www.reddit.com/r/wallstreetbets/search?sort=top&q=flair%3ADiscussion&restrict_sr=on&t=week)
**YOLO** | [All](https://reddit.com/r/wallstreetbets/search?sort=new&restrict_sr=on&q=flair%3AYOLO) / [**Best Daily**](https://www.reddit.com/r/wallstreetbets/search?sort=top&q=flair%3AYOLO&restrict_sr=on&t=day) / [Best Weekly](https://www.reddit.com/r/wallstreetbets/search?sort=top&q=flair%3AYOLO&restrict_sr=on&t=week)
**Gain** | [All](https://reddit.com/r/wallstreetbets/search?sort=new&restrict_sr=on&q=flair%3AGain) / [**Best Daily**](https://www.reddit.com/r/wallstreetbets/search?sort=top&q=flair%3AGain&restrict_sr=on&t=day) / [Best Weekly](https://www.reddit.com/r/wallstreetbets/search?sort=top&q=flair%3AGain&restrict_sr=on&t=week)
**Loss** | [All](https://reddit.com/r/wallstreetbets/search?sort=new&restrict_sr=on&q=flair%3ALoss) / [**Best Daily**](https://www.reddit.com/r/wallstreetbets/search?sort=top&q=flair%3ALoss&restrict_sr=on&t=day) / [Best Weekly](https://www.reddit.com/r/wallstreetbets/search?sort=top&q=flair%3ALoss&restrict_sr=on&t=week)

[Weekly Earnings Discussion Thread](https://www.reddit.com/r/wallstreetbets/search?sort=new&restrict_sr=on&q=flair%3A%22Earnings%20Thread%22)

**Read the [rules](https://www.reddit.com/r/wallstreetbets/wiki/contentguide) and make sure other people follow them.**

Try [No Meme Mode](https://www.reddit.com/r/wallstreetbets/search/?q=-flair%3AMeme%20-flair%3ASatire%20-flair%3AShitpost&restrict_sr=1&t=day&sort=hot), also accessible through the top bar.

---

[**Check out WSB.GOLD stats generated live from WSB activity**](https://wsb.gold/public/dashboard/e65fcfcb-70a4-4d86-b7fb-888057c67881)",https://www.reddit.com/r/wallstreetbets/comments/l6k51k/what_are_your_moves_tomorrow_january_282021/,380,"The Day by day Dialog is your day by day exchanging talk string. If it's not too much trouble keep the shitposting to a least. The Finest Day by day, Best Week after week and Best Talk are highlighted on Reddit's Divider Road Brokers' Every day Traders' Board",91
WHY GME COULD GO ON TO BREAK ALL RECORDS 🚀🚀🚀🚀🚀🚀🚀🚀🚀🚀🚀🚀🚀🚀🚀🚀🚀🚀🚀🚀🚀🚀🚀🚀🚀🚀🚀🚀🚀🚀🚀🚀🚀🚀🚀🚀🚀🚀🚀🚀🚀🚀🚀🚀🚀,"[Hold the line](https://streamable.com/g5yauf)

1. Everyday they try to cover their shorts and no one sells stock, the stock price would literally double.
2. Everyday they can't cover means they're BLEEDING money due to expensive interest rates they paid to borrow stock.
3. They're getting some help which only means we get more tendies. ALL YOU HAVE TO DO IS NOT SELL, BLEEDING THEM ALL OUT.
4. They have their tactics and dirty tricks to trap investors but as long as you know why that's happening you'll be fine. Also know the next day they will try to cover again leading to a further rise in stock price. After hours is what they can control so seeing a 10-20% decline after hours don't mean shit.
5. Literally HOLDING THE LINE and delaying gratification would pay off BIGLY. AND I MEAN BIG MASSIVE GREEN TENDIES.

I BELIEVE THE COMBINATION OF AUTISM AND RETARDATION WILL PREVAIL AND WE WILL CELEBRATE IN VALHALLA!

[Hold the line](https://streamable.com/g5yauf)",https://www.reddit.com/r/wallstreetbets/comments/l6k34p/why_gme_could_go_on_to_break_all_records/,177,"Ordinary, they attempt to cover their shorts, and no one offers stock; the stock cost would be truly twofold. All you have got to do isn't offer dying all them out. ",96
A thank you and goodbye in case I don't get another chance,"With what's happening right now I'm just worried like everyone else about an incoming ban. Fuck Melvin and fuck reddit for giving in to institutional pressure

I've been a member of this sub since 2016, originally on my old account u/MutantSushi and have loved every second. Its been amazing seeing the off-and-on Cramer name drops of this sub throughout the years and am genuinely shocked and proud that this community of retards has reached international news 

I'm proud of each and every one of you that has made life changing money in these last few days. It's an amazing thing to see people paying off student and medical debt and I'm just really happy to have been a part of it

Just wanted to get my last word in in case a ban is incoming

Love you all",https://www.reddit.com/r/wallstreetbets/comments/l6k1j5/a_thank_you_and_goodbye_in_case_i_dont_get/,147,"""I've been a part of this sub since 2016, initially on my ancient account MutantSushi"". I am pleased that each of you has made life-changing cash in these final few days. It's an astonishing thing to see individuals paying off understudy and vital obligations.",96
THEY HATE US COZ THEY AIN'T US,"Listen up retards.

Time immemorial, the rich and people in power will always want to fuck us normal people over. When someone breaks the norms and rules of those in power they bury us. Remember the flash crash? https://youtu.be/_ZDEWVJan0s

There's very few times in life an opportunity presents itself to grasp the moment. A moment which will change the entire course of your life. We've already transformed lines here. The success stories of comrades is heart touching.

But RIGHT NOW you need to be STRONG.
APES TOGETHER STRONG.

HOLD THE FUCKING LINE. DO NOT SELL.

LET's GO TO THE MOON 🚀 🚀 🚀 🚀 🚀 🚀 🚀",https://www.reddit.com/r/wallstreetbets/comments/l6jy01/they_hate_us_coz_they_aint_us/,106,"There are exceptionally few times in life after you can get a handle on the moment, which can alter the complete course of your life. The success stories of comrades are heart-touching, but right presently, you would like to be Solid. Don't offer. Don't Offer.",99
"Hold your positions, also AMC is not bot propaganda","The fact that we were attacked this hard means we’re on to something. Don’t sell. Don’t panic. Don’t listen to 🧻 🙌 retards telling you to sell.

Also there seems to be a consensus that AMC is bots. It’s not. They have the least amount of shares (out of the big ones were talking about here) and the second highest short interest. It’s common sense. 



💎 🙌 


Position ; 100 shares of amc @19, 33 shares of GME at 38$.",https://www.reddit.com/r/wallstreetbets/comments/l6jxvv/hold_your_positions_also_amc_is_not_bot_propaganda/,81,"AMC has the slightest sum of offers, and the moment's most noteworthy brief intrigued all the companies within the S&P 500. There appears to be an agreement that bots are behind this sell-on-AMC activity, but it's not likely to be their blame.",100
LETS HELP THE MODS WITH THE MEGAPHONE,"Like u/zjz said, this sub needs a fucking megaphone right now. I was just looking at Dave Portnoy (Barstoolsports) [quoting the wrong WSB MOD twitter account to give them a platform. ](https://twitter.com/stoolpresidente/status/1354589235643363334?s=21)

WE NEED EVEY RETARD AND THEIR WIFES BOYFRIEND TO @ [@Stoolpresidente ](https://twitter.com/stoolpresidente?s=21) TO LET KNOW THE CORRECT [WSB TWITTER MOD ACCOUNT](https://twitter.com/wsbmod?s=21)


IF WE LIKE THIS SUB THIS MUCH WE CAN FUCKING DO THIS

EDIT: 🚀🚀🚀 I LIKE THE STOCK🚀🚀",https://www.reddit.com/r/wallstreetbets/comments/l6jvni/lets_help_the_mods_with_the_megaphone/,88,"I was just looking at Dave Portnoy (Barstoolsports), quoting the wrong WSB MOD twitter account to give them a platform.",100
Anybody else notice a lot of AMC shilling? Big Boys manipulating sentiment?,"Not dogging on the AMC play at all but what’s the deal with everyone pumping “all in AMC” “AMC the next GameStop” “AMC AMC AMC!” all of a sudden?

Bots? Or some kind of orchestrated effort to divert attention away from GME as a last ditch effort? 

Seems to me that is the only weapon they possibly have left is to convince people to take their profit and move on to the next play so they get fucked a little less.

Hoping everyone else is catching on to this as well, good luck tomorrow retards 🚀🚀🚀

Edit: forgot positions 

50 shares at 49 

2 1/29 320c",https://www.reddit.com/r/wallstreetbets/comments/l6jtjs/anybody_else_notice_a_lot_of_amc_shilling_big/,107,A few kinds of organized exertion to redirect consideration absent from GME as a final discard exertion? It appears to me that the weapon they conceivably have cleared out is to convince individuals to require their benefit and move on to the following play.,96
Bloomberg Data Request Thread,"There is a LOT of bad data flying around and investors need good data to make responsible decisions, if you are looking for information which professionals would find on a service like Bloomberg or Eikon please post requests below or DM me. In addition, if you are willing to help answer questions and source data please DM me or help answer questions below.

&#x200B;

**Disclaimer: This post is titled ""Bloomberg Data Request Thread"" because professionals would look to Bloomberg first for this sort of information. I am not associated with or claiming to represent Bloomberg or any of its agents. Do not assume that the information provided here comes from Bloomberg, in fact please assume it does not regardless of what is said below. In addition, anything posted here is for informational purposes only and you should not assume anything is true or accurate or rely on it for investment decisions, you should only rely on reputable primary sources for data. You are solely responsible for what you do with information you obtain on this thread and bear all risk associated with those decisions.**

&#x200B;

edit: Please be specific re: what you are looking for. There are hundreds of fields (data points) for each ticker and if you only post the ticker I'm assuming you are only looking for short interest.

edit2: Appreciate the awards but please don't spend money doing that, would much rather you put money into more shares. How do I do a rocket emoji from my computer?

edit3: Would appreciate feedback on [these charts](https://www.reddit.com/r/wallstreetbets/comments/l6p8dz/gme_trade_volume_by_price_charts_show_dips_led_to/) \- do they and the title make sense to you? Want to bring in graphical content as well but want to make sure it's accessible.

edit4: I tried making other posts with actual points but think mods are rate limiting, understandable given the surge in activity but just heads up.",https://www.reddit.com/r/wallstreetbets/comments/l6jr5f/bloomberg_data_request_thread/,319,"""There's a Part of awful information flying around, and financial specialists need good information to form mindful choices"". I am not related with or claiming to speak to Bloomberg or any of its operators. Anything posted here is for enlightening purposes, as it were, and you ought not to accept genuine or precise anything.",100
