Title,Text,Link,Length,Summary,Score
Exit the system,"The CEO of NASDAQ pushed to halt trading “to give investors a chance to recalibrate their positions”.

[https://mobile.twitter.com/Mediaite/status/1354504710695362563](https://mobile.twitter.com/Mediaite/status/1354504710695362563)

Now SEC is investigating, brokers are disallowing buying more calls. This is the institutions flat out admitting they will change the rules to bail out the rich but if it happens to us, we get a “well shucks you should have known investing is risky! have you tried cutting out avocados and coffee, maybe doing Uber on the side?”

We may have collectively driven up enough sentiment in wall street to make other big players go long on GME with us (we do not have the money to move the stock as much as it did alone). we didn’t hurt wall street as a whole, just a few funds went down while others went up and profited off the shorts the same as us. The media wants to pin the blame on us.

It should be crystal clear that this is a rigged game by now. Its time to build new exchanges that can’t arbitrarily change the rules on us. Cr\*\*o has some version of these, maybe they can be repurposed to be trade stock without government intervention. I don’t know exactly what it will look like yet, but the broad next steps i see are - 1. exit the current financial system 2. build a new one.",https://www.reddit.com/r/wallstreetbets/comments/l6uhhn/exit_the_system/,242,"NASDAQ was shut for a while by the CEO to help investors by allowing more time to change their positions. However, SEC is investigating the issue, and the media is blaming the rich players. The rich have proposed that government should not intervene by exiting the current financial system to build a new one.",100
SHORT STOCK DOESN'T HAVE AN EXPIRATION DATE,"Hedgefund whales are spreading disinfo saying Friday is make-or-break for $GME. Call options expiring ITM on Friday will drive the price up if levels are maintained, but may not trigger the short squeeze.

It may be Friday, but it could be next week the we see the real squeeze.

DON'T PANIC IF THE SQUEEZE DOESN'T HAPPEN FRIDAY.

It's not guaranteed to. The only thing that is guaranteed mathematically is that the shorts will have to cover at some point in the future. They are trying to get enough people hooked on the false expectation of Friday so that if/when it doesn't happen, enough will sell out of panic/despair. DON'T BE THAT PERSON.

WE LIKE THE STOCK",https://www.reddit.com/r/wallstreetbets/comments/l6uf6d/short_stock_doesnt_have_an_expiration_date/,125,"Hedgefund whales are spreading misinformation that Friday is the day of do-or-die. The ground truth is that the real squeeze would happen next week and not this Friday. People would get false expectations of Friday and then sell out in panic, and you should not be that person.",100
THIS IS THE MOMENT,"Life isn't fair. My mother always told me that when I would complain about arbitrary treatment. I would play by the rules and someone else would ignore them. When they would win I would appeal to the first authority for an explanation. ""Are you going to let them get away with this""? ""Life isn't fair"". No, it is not. The game is the game. Always.

In this moment, the fascade cracks further. When the first breach was made I do not know, perhaps it was Socrates, but today I see thousands. Millions. 

Once they were laughing, luxuries falling out of their disgusting diseased mouths as they cackled. The unmistakable stench of derision carried on their breath. They told anyone outside of their elite class that we were fools for even trying. They told us that we were naive. We needed networks to be successful. We needed polish. We needed expertise. We needed THEM. The game is the game. Always. 

They are no longer laughing. Their odious oeuvre still wafts through the air. While the rot, and hate, and condescention, remains, the noxious air betrays a new addition. Something all together disconcerting. What it betrays, is fear. They are afraid. And they should be. We do not need their inherited resources masked as acumen. A new day dawns. The day where we make an ever so slight step towards what they fear the most. An even field. Life becoming ever so slighty more fair.   AND. THEY. ARE. SCARED. They look at us and see roughness. We look at them and see softness. We are both correct in our estimation.

The game is the game. Always.

Fuck them in the street. Fuck them all in the street. We are the righteous. We are blessed by Phoebe. What started here will echo through time in the eons to come. Mount up and ride with the fury of a thousand rockets into the universal filament. May the wind always be at your back and the sun upon your face. And may the wings of destiny carry you aloft, to dance with the stars.

GME@everything BB@everything

🚀🚀🚀🚀🚀🚀🚀",https://www.reddit.com/r/wallstreetbets/comments/l6ub9l/this_is_the_moment/,355,"In this moment, the fascade cracks further. When the first breach was made I do not know, perhaps it was Socrates, but today I see thousands. What started here will echo through time in the eons to come. Mount up and ride with the fury of a thousand rockets into the universal filament. May the wind always be at your back and the sun upon your face.",88
"We need to keep this movement going, we all can make history!"," I believe right now is one of those rare opportunities that we all can help and do good. Some of these companies like GME, AMC are good companies that's been hit hard by this pandemic. Hedgefunds and Wallstreet just want to short these companies to zero and make millions. 

 I really think right now we have enough support and enough of us to change that direction in history. Wallstreet says  well weak companies need to just go. 10 yrs down the road though I want to be able to watch a movie in a movie theater with my family. If we all buy and hold in what we believe in it gives these companies a second chance and we as a group can stop these companies from being shorted to death and just disappear. Just my 2 cents!",https://www.reddit.com/r/wallstreetbets/comments/l6uao1/we_need_to_keep_this_movement_going_we_all_can/,139,"Hedge funds and Wallstreet fair need to brief these companies to zero and make millions. Ten yrs down the street, even though I need to be able to observe a motion picture in a motion picture theatre with my family. In case we all purchase and hold in what we accept, it gives these companies a moment chance. Fair, my 2 cents!",91
"Once you're done with GME - $AG and $SLV, the gentleman's short squeeze, driven by macro fundamentals","You guys are champs. GME... who would have thought a bunch of crazy retards could reach the front page of the New York Times.

And when you're done with GME, it's time to punish the big banks who have been suppressing the price of silver since the Bear Stearns / JPM merge. It's all in fucking Bloomberg:

[https://www.bloomberg.com/news/articles/2019-09-16/precious-metals-traders-charged-with-rigging-futures-contracts](https://www.bloomberg.com/news/articles/2019-09-16/precious-metals-traders-charged-with-rigging-futures-contracts)

There's an excellent explanation of their scheme here

[https://www.listennotes.com/podcasts/palisades-gold-radio/ted-butler-squeezing-out-the-hqxQ5mOdt02/](https://www.listennotes.com/podcasts/palisades-gold-radio/ted-butler-squeezing-out-the-hqxQ5mOdt02/)

You think GME squeezed hard? Look what happened to silver half a year ago in July:

&#x200B;

https://preview.redd.it/3yssvdm7y1e61.png?width=2588&format=png&auto=webp&s=25d4cfa973d57f1f6083affdcecf6b35e4055a7f

That's one of the banks getting squeezed out of silver, having to cover their shorts... and that's just because rich boomers freaked out about financial instability and finally started calling out the Comex on their bullshit, and taking physically delivery of silver... which they don't have.

Now imagine 4 million degenerates buying $SLV, forcing the trust to take delivery of physical silver from the Comex. This isn't GME, who's fair price is maybe around $5 a share. The FAIR price of silver based on the historical gold/silver ratio is almost surely over $50/ounce. This short squeeze will be a fantastic success even if we can take silver to it's fair market value.

And then there's $AG. Because once silver starts moving, $AG is going to go to the fucking moon. 1) it's a leverage play on silver, 2) It's got it's OWN SHORTS TO BE SQUEEZED OUT. At least a 23% short float as of last count: [https://shortsqueeze.com/shortinterest/stock/AG.htm](https://shortsqueeze.com/shortinterest/stock/AG.htm)

**TL;DR: Once this thing gets going, shares and calls of $SLV and $AG will** ***rocket.***

Edit: **🚀🚀🚀🚀🚀🚀🚀🚀🚀🚀**",https://www.reddit.com/r/wallstreetbets/comments/l6u9wu/once_youre_done_with_gme_ag_and_slv_the/,361,"Envision 4 million ruffians buying $SLV, constraining the belief to require conveyance of physical silver from the Comex. This isn't GME, whose reasonable cost is possibly around $5 a share. The Reasonable cost of silver based on the verifiable gold/silver proportion is near, without a doubt over $50/ounce. ",89
"Daily Discussion Thread for January 28, 2021","Your daily trading discussion thread. Please keep the shitposting to a minimum. 

^Navigate ^WSB |^We ^recommend ^best ^daily ^DD
:--|:--                                 
**DD** | [All](https://reddit.com/r/wallstreetbets/search?sort=new&restrict_sr=on&q=flair%3ADD) / [**Best Daily**](https://www.reddit.com/r/wallstreetbets/search?sort=top&q=flair%3ADD&restrict_sr=on&t=day) / [Best Weekly](https://www.reddit.com/r/wallstreetbets/search?sort=top&q=flair%3ADD&restrict_sr=on&t=week)
**Discussion** | [All](https://reddit.com/r/wallstreetbets/search?sort=new&restrict_sr=on&q=flair%3ADiscussion) / [**Best Daily**](https://www.reddit.com/r/wallstreetbets/search?sort=top&q=flair%3ADiscussion&restrict_sr=on&t=day) / [Best Weekly](https://www.reddit.com/r/wallstreetbets/search?sort=top&q=flair%3ADiscussion&restrict_sr=on&t=week)
**YOLO** | [All](https://reddit.com/r/wallstreetbets/search?sort=new&restrict_sr=on&q=flair%3AYOLO) / [**Best Daily**](https://www.reddit.com/r/wallstreetbets/search?sort=top&q=flair%3AYOLO&restrict_sr=on&t=day) / [Best Weekly](https://www.reddit.com/r/wallstreetbets/search?sort=top&q=flair%3AYOLO&restrict_sr=on&t=week)
**Gain** | [All](https://reddit.com/r/wallstreetbets/search?sort=new&restrict_sr=on&q=flair%3AGain) / [**Best Daily**](https://www.reddit.com/r/wallstreetbets/search?sort=top&q=flair%3AGain&restrict_sr=on&t=day) / [Best Weekly](https://www.reddit.com/r/wallstreetbets/search?sort=top&q=flair%3AGain&restrict_sr=on&t=week)
**Loss** | [All](https://reddit.com/r/wallstreetbets/search?sort=new&restrict_sr=on&q=flair%3ALoss) / [**Best Daily**](https://www.reddit.com/r/wallstreetbets/search?sort=top&q=flair%3ALoss&restrict_sr=on&t=day) / [Best Weekly](https://www.reddit.com/r/wallstreetbets/search?sort=top&q=flair%3ALoss&restrict_sr=on&t=week)


[Weekly Earnings Discussion Thread](https://www.reddit.com/r/wallstreetbets/search?sort=new&restrict_sr=on&q=flair%3A%22Earnings%20Thread%22)

**Read the [rules](https://www.reddit.com/r/wallstreetbets/wiki/contentguide) and make sure other people follow them.**

Try [No Meme Mode](https://www.reddit.com/r/wallstreetbets/search/?q=-flair%3AMeme%20-flair%3ASatire%20-flair%3AShitpost&restrict_sr=1&t=day&sort=hot), also accessible through the top bar.

---

[**Check out WSB.GOLD stats generated live from WSB activity**](https://wsb.gold/public/dashboard/e65fcfcb-70a4-4d86-b7fb-888057c67881)",https://www.reddit.com/r/wallstreetbets/comments/l6u011/daily_discussion_thread_for_january_28_2021/,365,Your daily trading discussion thread. Would you please keep the shitposting to a minimum? There are a lot of links in this post which are related to trading discussion.,
We need to stick together and 💎🖐 the ever lovin shit out of this opportunity. We will leave no man or woman behind! Forward! Together!,"This is our time. If anyone will listen to you, please explain to them why GME is one of the very best investments they can make right now. I have already gotten 5 people close to me to research what is happening and they decided to dump everything into GME. NOT AMC, NOT NOK, NOT BB, but GME. After last night's AH manipulation I am not selling until at least 5k to 10k a share. We need to encourage people to have the courage to hold. We finally have the power to change our futures. They want us begging again and again for stimulus checks while they laugh at us as they sip champaign from gold plated glasses. We are a fucking joke to them. Well, now, how the fuck does it feel? This is our chance at financial freedom. This is our moment. Fellow poors! Rise up! We will be enslaved no more!",https://www.reddit.com/r/wallstreetbets/comments/l6two5/we_need_to_stick_together_and_the_ever_lovin_shit/,155,Making an investment at GME is the best investment than any other of its kind. I won't be selling until it's 5 - 10 K a share. We should encourage people to hold the stocks which would help us to change the future according to our needs.,97
I'm so proud of how far this subreddit has come,"I still remember when I first joined and most people here were going all in on binary options trades on things like trial results being positive or negative from a pharmaceutical company. Back when penny stocks weren't against the rules, the days of delisted tickers like OMVS and the others. I know a lot of you (about 2 million in the past couple of days) are new here, but I just wanted to say this has been one hell of a journey over the years with you guys.

I joined WSB back when I was still in highschool. I feel like I've grown up with you guys. I still remember losing $2000 on my 21st birthday when one of these biopharm companies we were all playing released their trial phase results. That was a lot of money to me then, still is to be honest, but I'll be damned if I didn't have a hell of a time and learn a lot of valuable information in losing that couple thousand dollars. I still remember how happy I was when i logged in one day to see i had finally earned a flair in my favorite subreddit as well.

It's 5 am here and I'm kind of cooked right now off the sauce, so I'm probably rambling at this point, but I just wanted you to know that I love you all and you're all some very unique people. Being here in this sub is proof enough of that to me. I hope you are all blessed with as many tendies as you can eat. And remember, whatever happens, it's never aloha, we'll always see each other once again boys and girls.

positions: 100% cash, still waiting to fomo @ the top for the sweet sweet loss porn

edit: for positions",https://www.reddit.com/r/wallstreetbets/comments/l6tuae/im_so_proud_of_how_far_this_subreddit_has_come/,309,I was still in high school when I joined WSB. It was the time when penny stocks weren't against the rules and the days of delisted tickers like OMVS and others were present. I remember how happy I was when I logged in one day to see I had earned a flair.,99
My brokerage wants to force close my GME calls,"My brokerage called me and asked me to close my 115 calls expiring this friday. If I wouldn't close them at todays market open, they'd do it, and they'd do it for all customers with GME options expiring this friday. I could open a position expiring next week if I wanted to.

&#x200B;

Their reasoning was that I didn't have enough cash to exercise the calls and they don't know if trading of GME will be halted for some time in the next few days. Therefore my calls would get exercised with my balance in the negative.

&#x200B;

Now, I'm fine with closing the position and rolling it out to next week and a higher strike, since I also have a ton of shares. But this still sounds fishy to me, like they wanted to minimize the amount of shares they'd have to buy to hedge for another gamma squeeze. They told me I ""also had other positions that were heavily covered in the media, but those were fine, GME realls is a big exception right now""

&#x200B;

\[Positions\]([https://imgur.com/a/NLXQsEK](https://imgur.com/a/NLXQsEK)) (options only)

&#x200B;

Edit: After I was being sceptical on the phone and asked if they could just close shit like that, he told me it was ""a very unusual situation with big risk involved""   

I told him that there are apparently enough hedge funds with no risk management either, and that we wouldn't be in this situation otherwise. But he didn't seem like he wanted to hear that.",https://www.reddit.com/r/wallstreetbets/comments/l6te9s/my_brokerage_wants_to_force_close_my_gme_calls/,267,"My broker called me and asked me to close my 115 calls that are expiring this Friday. They reasoned that I didn't have enough cash to exercise the calls. They wanted to minimize the amount of share, but they'd have to hedge for another gamma squeeze that seems to be fishy.",99
Iacta alea est,"I was the lucky one in my family.  In 2008 I was in the middle of my first enlistment.  My college had been taken care of beforehand, because I'd been accepted into a program at UMass Boston for high school students with above-average grades.  A week after graduating high school I received a degree in psychology and went off to be a Marine.

I remember 2008.  I remember my father's savings being nuked, his portfolio going to zero.  Twenty years in the United States Navy and he'd had his savings completely obliterated because of the collapse that Wall Street caused.  I remember my mother calling me in the middle of the night--I was in Okinawa, Japan at the time--and crying because the savings were gone.  That day I started sending a measly $1,000 a month to my family to take care of bills and keep my siblings fed.  My grandmother's retirement was gone in the blink of an eye but she survived, because she loved her job (she was still working in her 60s at a retirement home).  But she had to get a reverse mortgage to keep the house.  I didn't have to send money too long--only about five months--until my father got a better job, and my mother was able to get her own job as well.  But I remember the desperation in her voice.

I'm 34 now.  I've done my time in the military.  No pension, I didn't serve long enough.  But now I can look at this entire debacle and fucking laugh.  I'm a capitalist at heart.  I support being paid for your services.  But I remember the bullshit you engaged in, and I know many others do as well.  Occupy Wall Street did fuck all to you.  But now the internet has given way to arguably the worst thing for you: actual communication and planning.  Now you're seeing what a group of people who loathe everything you stand for can do to you in days.  You won't learn from it, though, which is okay.  This may not keep happening, but every time you decide to attempt something like this the fear will be there, in the back of your mind.  I wish I could have gotten in on this.  I'm not able to spend money like many of these people can.  But I hope it hurts, and it seems like it is.

And there should be no mercy in a situation like this.  Hound them until they concede.  And always remember the motto of the Marine Corps, ""Semper fidelis""--Always Faithful.",https://www.reddit.com/r/wallstreetbets/comments/l6td49/iacta_alea_est/,444,I started sending 1000$ a month to take care of the bills and keep my siblings fed. Our grandmother retired in the block of an eye and then she had to get a reverse mortgage. Though I am capitalist at heart but I send money. I support being paid for your services.,89
There is an alternative to this system,"How fucking stupid is it that retail gets no chance to participate in any stage of an ipo - I’ve always thought how incredibly fucked up is it that hundreds of people who have literally nothing to do with the formation or creation of a company are buying a pre-ipo at $10 then selling it to millions of retail at $100 only to watch it crash back to $5. We sit there terrified hoping the big guys throw us a bone. For those of us here at WSB the last 5 years this leads to massive disillusionment. And it’s all fun and games because everyone on the inside wins. How stupid is it that there is no transparency to the underpinnings of valuation and that there is 0 regulation of shorting a company and fucking it’s employees beyond 100% float just to control the asset?

When the dust settles be aware there is a massively growing system that does exists which does not allow this that is called decentralized finance. Worth learning about the future early


Edit: I don’t know for sure but I predict The GME situation ends when the government prints the $ to give to Melvin and friends bc this is an inflationary system and that’s what happens. They’ll be upset they didnt just print the $ earlier. The De-FI space is backed by deflationary systems and it’s worth understanding why that’s so profoundly different.",https://www.reddit.com/r/wallstreetbets/comments/l6tauf/there_is_an_alternative_to_this_system/,245,"It is stupid that retail gets no chance to participate in any stage of the IPO. There is no transparency to the underpinnings of valuation, and people who have nothing to do with the company buy shares at a low price and sell everything at a high price to make the company bankrupt.",99
"The real price for GME is infinity, but at that price your option is worth nothing.","Lets imagine GME has gone to 50,000. The market has gone offerless, when you exercise your option instead of stock you get 'oops, please wait while we connect you to our operator' and your shitty broker is simply ghosting you and turning off the phone line. Even your stupid lawyer refuses the case because supereme court has suspended the constitution for GME stock holders.

But lets do some maths. If every person on the sub bought 1 call option strike 100. At price 50k that means the seller is liable for 49900x100x2,000,000= 10trillion.

This will destroy not only the dirty dealing worthless billionaires and the shitty market making crooks, it will destroy the entire economy and not a single one of you will get paid because no one has 10 trillion to pay you, and even if they had, they wouldnt, the fed is not going to print 10 T so you can make your gains, no way. The US financial market is a hollow crooked ponzi and has been for years and there is no way they can stand or accept this hit.

The real price for GME is infinity but at that price, unfortunately your call option is worth nothing. It will be reneged.",https://www.reddit.com/r/wallstreetbets/comments/l6t34h/the_real_price_for_gme_is_infinity_but_at_that/,209,"Think that when you are exercising your stock option and at the moment you are about to get stock, you get ""oops, please wait while we connect you to our operator"" and your broker is simply ghosting you. The seller is liable for huge stocks even if each buyer buys small amount of stock.",90
OG's......Prepare to show the world who we are,"The time has come for us to show the world who we really are and what we are truly capable of. There is no one else better on the PLANET to hold on to this squeeze than the OGs of this sub. We spend our days swinging on volatility that would make others cry. We don't blink an eye at a position down 70%, knowing it's headed to 600% in the green. Most of us have been preparing for this moment our entire trading careers. We were made for this.

This Friday the old guard is going to send us all on a vomit inducing #GRAVITATIONAL #GAMMA #CAPTURE. They have likely been selling poots and buying debit call spreads up and down the chain. That paired with pure insanity on the call side of the chain is going to ignite the boosters on perhaps one of the largest gamma squeezes ever seen. As we start to lift off, they will begin arresting the rocket with shorts and buying back calls as we start to cash out our options. Eventually gravity will take over plunging #DeepValue I back to earth. As they continue to short, others will begin to panic sell speeding up the decent.......but we are the force to create terminal velocity. 

As the dust settles ........and the 🧻🤚s we lost along the way and the rest of the world look up to see us standing there, unflinching, staring at the MMs, the MSM, the shorts and everyone else.......#HOLDING........as if nothing happened.......and DFV post the update.......still holding........still up millions........the world will never be the same.

[Hold Spartans](https://i.imgur.com/vE0DtOV.gif)


Good luck gentlemen










Above is my unprofessional opinion........trade accordingly.",https://www.reddit.com/r/wallstreetbets/comments/l6t1jl/ogsprepare_to_show_the_world_who_we_are/,292,"""It is the time when we have to show what we really are and our capabilities"". The OGs of the club are the best on the planet to hold the squeeze. It is going to ignite the boosters on perhaps one of the largest gamma squeezes ever seen.",96
