Title,Text,Link,Length,Summary,Score
Short RobinHood on RobinHood?,"You may be annoyed by what RobinHood did by not allowing additional buying of your beloved deep value stocks in your watchlist that you have been eyeing for months such as GME, AMC, NOK, BB, EXPR, KOSS, etc. You may have a good memory. You may be spiteful. You may be aware that RobinHood is expected to IPO sometime this year. You may keep an eye out for that day. You may on that momentous day take your hard-earned stimmy and choose to short RobinHood on the basis that RobinHood isn't the most user friendly platform given your negative experience. Cuz its what it is. Think about it.",https://www.reddit.com/r/wallstreetbets/comments/l6wvwo/short_robinhood_on_robinhood/,110,"Robinhood did not allow us to buy deep value stocks such as GME, AMC, NOK, BB, EXPR, KOSS etc. Robinhood is expected to IPO sometime this year. You may on that day take your hard-earned money and choose to short Robinhood beacuse Robinhood is not the most user friendly platform. ",90
"Boeing, its gonna come back","We all know Boeing has taken multiple blows both from quality control issues and because of the elephant in the room, COVID. BUT, contrary to what some think, Boeing will NOT got out of business, its the US governments baby. The US government will NEVER let Boeing declare bankruptcy, so my tip is buy Boeing now that is low, and wait 4-5 years... let Boeing rebound, and sell for a profit. I've already done this, and it works but it's a long term game. At best, its a 4-5 month play.",https://www.reddit.com/r/wallstreetbets/comments/l6wvvf/boeing_its_gonna_come_back/,95,"Boeing has taken multiple blows both from quality control issues and because of the elephant in the room, COVID. Contrary to what some think, Boeing will NOT got out of business, its the US governments baby. The US government will NEVER let Boeing declare bankruptcy.",91
What are you going to do with your GME Payday Check?,"A lot of people here have made money, self included.  Without saying the amount, what is your intention to use with the money you will be making?  I, for one, will be paying 1/4 or more to the IRS immediately since the money isn't in retirement, but a different account.  I will be donating another $5,000.00 to the church I grew up on (though I'm an atheist now, this church is the best church I've ever encountered, not like some mega-church, real down to earth people), I'll be getting my wife a nice gift, finish paying for my daughter's wedding, and I will be stashing some of it away until my C8 rolls off the assembly line.  The rest I will be trading as this has put me closer to retirement (I'm in my 50's) than I've been in a while.  This is an amazing ride!  I've already read a lot of people saying they've paid off student loans, reduced debt, paid of parent's houses, or their own houses and I'm psyched for everyone here and interested in what you plan on doing!",https://www.reddit.com/r/wallstreetbets/comments/l6wvsy/what_are_you_going_to_do_with_your_gme_payday/,199,"What do you intend to do with the money you make this week? I, for one, will be paying 1/4 or more to the IRS immediately since the money isn't in retirement. The rest I will be trading as this has put me closer to retirement than I've been in a while.",99
Robinhood Pending Order,"As everyone is probably aware as the news spreads, robinhood stopped users from purchasing new stocks, but I have a question! I have a pending order from 1:30 this morning when I finally had time to read everything going on and wanted to stick it to Wall Street. Will this order be honored, or is it likely that they will cancel it? If the order was placed before the restrictions, can they just up and cancel it?

To the moon 🚀",https://www.reddit.com/r/wallstreetbets/comments/l6wvfx/robinhood_pending_order/,81,"""Robinhood"" stopped users from purchasing new stocks, but can they just up and cancel it? ""I have a pending order from 1:30 this morning when I finally had time to read everything going on and wanted to stick it to Wall Street"".",100
"I am so proud of you people, and am cheering on you from the sidelines!","I work as a lowly peasant for Wall Street Cocksuckers, which means that I not only have to preclear all trades, but also have to hodl each security 30 days.

While I cannot get in on the action, I just want to say, what you guys are doing is AMAZING.

These Hedge Fund people are the worst of the worst, the slimiest and most sociopathic people in the society, up there with our DC politicians.

Seeing people be able to pay off their student loans, mortgages, etc instead of more coke and wealth for these assholes; it truly warms my heart.

🚀🚀🚀🚀🚀🚀🚀🚀🚀🚀🚀🚀🚀🚀",https://www.reddit.com/r/wallstreetbets/comments/l6wvfl/i_am_so_proud_of_you_people_and_am_cheering_on/,101,"These Hedge Fund people are the worst of the worst, the slimiest and most sociopathic people in the society. Seeing people be able to pay off their student loans, mortgages, etc instead of more coke and wealth for these assholes warms my heart.",91
Their resistance is proof of our success,"The latest step they've taken is to close GME trading on Robinhood and AMTrading. If you're worried that this is a bad sign, ask yourself the following questions:

* Why would these brokers decide to do things that they know will piss off a significant portion of their users to the point of boycotts, lawsuits and coordinated bad reviews?
* Why would the Financial Times and NBCN risk their reputation on spreading false information on WSB, Reddit and hedgefund positions?
* Why would anyone care enough about a subreddit that they will create bots to fellow-kid-spam any other stock just to cause division?

The answer is very obviously economic interests. The people and organizations behind are the ones who stand to lose from this. Their resistance shows that we're doing fine. Their worry should make us smell blood.

Buy and hold GME and you'll be on the right side of history financially, socially and legally.

I am not a financial advisor and this is not a financial advice. I literally just dunked my head into the keyboard and this came out.",https://www.reddit.com/r/wallstreetbets/comments/l6wv02/their_resistance_is_proof_of_our_success/,184,"If you're worried that this is a bad sign, ask yourself the following questions: * Why would these brokers decide to do things that they know will piss off a significant portion of their users to the point of boycotts, lawsuits and coordinated bad reviews?
Why would the Financial Times and NBCN risk their reputation on spreading false information on WSB, Reddit and hedgefund positions?",98
Biggest Financial regret and how I couldn't be happier still.,"I am a poor, I have always been a poor for some reason or another and I have a few big regrets.Is it the time my buy order bounced for $25 dollars worth of (un-named crypt-0) in 2008 and I told myself ""Id get back to it""? No

Is it the time I dumped everything into a short film only to lost 2/3rd of funding while in route to location IN another country? No

Both times I opted not to renew a lease pre-emptively for road gigs that ended up falling through last second? No.

Not buying GME low? Close but no.

The biggest regret is not buying GME at all until whatever I can spare today as a message. This reddit group has done something that sends a message larger and more impactful than any of the work I did with OWS. Any of the predatory school loan assistance I've done.

&#x200B;

Within 48 hours y'all have utterly fucked the mouths of people who have been stealing everyone's food for a century. I couldn't be more proud of you god damn psychopaths and today I will most likely throw some money into a void simply to show my appreciation. Memes and jokes aside, a shot was fire and it proves that a large enough group of people can redistribute some wealth if they fucking feel like it and their is very little anyone in power can do a god damn thing.

Congratulations to all you god damn spacemen.

Ps:Form a firm called Spacemen, Spacemin & The Tendies. I think it'd look real good replacing the marquee of one of these hedge funds one day.

Pps: Had to post again because mention of certain things got automodded",https://www.reddit.com/r/wallstreetbets/comments/l6wuym/biggest_financial_regret_and_how_i_couldnt_be/,297,"I am a poor, I have always been a poor for some reason or another and I have a few big regrets.Is it the time my buy order bounced for $25 dollars worth of an crypti in 2008 and I told myself I would get back it. I couldn't be more proud of you and today I will most likely throw some money into a void simply to show my appreciation.

A shot was fire and it proves that a large enough group of people can redistribute some wealth if they feel like it and their is very little anyone in power can do a god damn thing.",96
ROBINHOOD DOWN?,as always i miss out   on shit like this because im  taking a  break from the internet. Serious  Fomo rn. Im  layingg in bed choosing  which stock to load up on while  their relatively low afterhours. But low and behold  i  cant choose any because AMC CTRM and GME all  wont trade  on robinhood? I  cant  even  type anything into the search bar  like they found  out im trying to hop on the train. smh,https://www.reddit.com/r/wallstreetbets/comments/l6wuya/robinhood_down/,75,I am lying in bed choosing which stock to load up on while they're relatively low after hours. But low and behold I cant choose any because AMC CTRM and GME all won't trade on Robinhood? I can't even type anything into the search bar like they found out I'm trying to hop on the train.,97
HOLD THE FUCKING LINE,We’re not gonna forfeit just because we lost RH ago those cock suckers. The openly corrupt manipulation of the “free” market is a clear sign we’re nearing the finish line. WE CANT STOP HERE. I sold all my SNDL stocks yesterday at 53 fucking cents for 2000. SNDL IS AT $1 RIGHT NOW BUT I DID IT FOR GME AND BB. NOW there’s no turning back. I will fully RIDE TIL I FUCKING DIE FUCK THE SYSTEM,https://www.reddit.com/r/wallstreetbets/comments/l6wux8/hold_the_fucking_line/,80,We’re not gonna forfeit just because we lost RH The openly corrupt manipulation of the “free” market is a clear sign we’re nearing the finish line. I sold all my SNDL stocks yesterday at 53 cents for 2000. I will fully RIDE till i die.,97
Broke Bois,"For those of us who lack the nugs to pony up anymore on the big rocket what can we do to stick it to the hedge funds even more?

I can’t drop anymore bread into GME at this point. Out of my price range and I think so broke bois can agree. I’ve been dipping into SNDL trying to see if this pint sized size stock can at least make it into orbit. I’ve got enough to make small gains there. Not enough to buy a telsa but maybe some bags of frozen tenders. 

What do y’all think?",https://www.reddit.com/r/wallstreetbets/comments/l6wuva/broke_bois/,102,"""For those of us who lack the nugs to pony up anymore on the big rocket what can we do to stick it to the hedge funds even more? I can't drop GME. I’ve been dipping into SNDL trying to see if this pint sized size stock can at least make it into orbit.  I got small gains but not enough to buy tesla",86
NOK is legit. NOK is a setup by WS Bots. Which is it? Short Interest is 1%?,"Hi all, as the title says, there's a lot of conflicting info out there on NOK. Just hoping someone with a bigger brain than I can provide some solid advice (non-financial of course :-) )

I admit, I'm new to shorting and short interest but if I'm looking at this right, Short Interest is only a little over 1.1%. Aren't we looking for stocks with a way higher percent? Or are we expecting that to come later?",https://www.reddit.com/r/wallstreetbets/comments/l6wuli/nok_is_legit_nok_is_a_setup_by_ws_bots_which_is/,81,"As the title says, there is conflicting info on NOK. My non-financial advice feels short interest is right as it is only a little over 1.1%. Aren't we looking for stock with a higher percentage?",96
Deleting Robinhood!,"This is blatant market manipulation by the only Corp we thought had our backs. Robinhood is supposed to take from the rich and give to the poor, but not this Robinhood. This Robinhood probably just got lobbied by his buddies Melvin, Shitron, Cramer and anyone else on CNBC. I’m deleting Robinhood and moving to another platform (probably webull) and Robinhood will go down in history as an EPIC EPIC failure. A rocket that could have gone to the moon, but ended up like the challenger in flames💥!Sincerely, FUCK YOU @Robinhood. Our positions are still going to the moon because we are a community and we are together! Let’s ride today boys...let’s RIDE!

Any other platform recommendations?",https://www.reddit.com/r/wallstreetbets/comments/l6wuim/deleting_robinhood/,121,"Robinhood is supposed to take from the rich and give to the poor, but not this Robinhood. This Robinhood probably just got lobbied by his buddies Melvin, Shitron, Cramer and anyone else on CNBC. I’m deleting Robinhood and moving to another platform (probably webull) and Robinhood will go down in history as an EPIC failure.",92
15 hours ago Robinhood CEO said his platform empowered the people...TILL HE TOOK IT FROM US,"[https://finance.yahoo.com/news/robinhood-ceo-retail-investors-have-felt-like-they-have-been-talked-down-to-are-now-empowered-214947293.html](https://finance.yahoo.com/news/robinhood-ceo-retail-investors-have-felt-like-they-have-been-talked-down-to-are-now-empowered-214947293.html)

Can't buy Gamestop, AMC, Blackberry, or Nokia on Robinhood anymore to help fuel short squeeze. If anyone has any other way of investing in these stocks please comment down below. Don't sell your positions. For now I guess I'm moving into AAL and SPCE. 

&#x200B;

If this stays a thing, when Robinhood IPO comes out we should all short.",https://www.reddit.com/r/wallstreetbets/comments/l6wui0/15_hours_ago_robinhood_ceo_said_his_platform/,108,"Can't buy Gamestop, AMC, Blackberry, or Nokia on Robinhood anymore to help fuel short squeeze. Don't sell your positions. For now I guess I'm moving into AAL and SPCE. If this stays a thing, when Robinhood IPO comes out we should all short.""",79
Master list of brokers and who is restricting what:,"NO POSTING OF REFERRAL CODES!


Please help me get together the list of available brokers by country and which ones are and aren't limiting the purchase and sale of stocks/options. If you broker is telling you what you can and can't do, it's time to find a new broker.

---

USA-

---

ETrade (Power): No restrictions

Fidelity: No restrictions

Interactive Brokers:

Robinhood: Only cash secured options.

Schwab:

Tastyworks:

TD Ameritrade: No buying of shares.

Webull:

---


UK-

---


Trading 212: Operating in reduce-only mode. No buying shares.


---


Positions or ban: 30 shares of GME. I believe in their future and like the stock.",https://www.reddit.com/r/wallstreetbets/comments/l6wufr/master_list_of_brokers_and_who_is_restricting_what/,104,"Please help me get together the list of available brokers by country and which ones are and aren't limiting the purchase and sale of stocks/options.

--- USA- --- ETrade (Power): No restrictions Fidelity: No restrictions Interactive Brokers: Robinhood: Only cash secured options.",97
Honest question about short selling with regards to GME,"Hi. First of all, I am blown away with what this sub has achieved. Congrats to all of you. Hold the line and wait.. wait.. until they feel the pain.. until they start to bleed.. and then we sell! 

I was watching CNBC and Andrew Sorkin said that one reason the short is 140% is that the same share is shorted multiple times. Very simply, A owns the original share, B shorts it by borrowing from A and sells it to C, D shorts  it by borrowing from C and so on. Can someone explain if that is possible? Doesn't that mean that, in theory, the short percentage can be multiple times the float? Almost seems there should be rules to prevent this. 

By the way, I am watching CNBC and it took them a long time to ask this basic question. They will talk down on the little guys as mania, dumb money etc, but spend little time talking about how such a high short percent is even possible. Their audiences are really the wall street and not the average Joe investor looking for more information. 

GME 🚀🚀🚀🚀🚀🚀🚀🚀",https://www.reddit.com/r/wallstreetbets/comments/l6wuey/honest_question_about_short_selling_with_regards/,189,"I was watching CNBC and Andrew Sorkin said that one reason the short is 140% is that the same share is shorted multiple times. Very simply, A owns the original share, B shorts it by borrowing from A and sells it to C, D shorts it by borrowing from C and so on. They will talk down on the little guys as mania, dumb money etc, but spend little time talking about how such a high short percent is even possible.",85
1 star Robinhood Reviews,"I am really happy my buy order is placed for 500 more dollars of GME shares at market today. Saw snapshots of people who can’t trade amc, GME 🚀🚀🚀🚀, BB not supported!!?? YO FUCK ROBINHOOD I’m downvoting them on apple store and otherwise expressing my opinion in a legal way. If you feel the same way then I would imagine that you would do the same thing! CROOKED BIG MONEY!",https://www.reddit.com/r/wallstreetbets/comments/l6wuev/1_star_robinhood_reviews/,71,I am pleased by my decision to buy order is placed for 500 more dollar of GME. I am disappointed with Robinhood and downvoting them on apple store and express in a legal way. He suggested others to do same if they feel the same way,60
5K GME is a potential 400-500 billion dollar loss to wallstreet.,"Robinhood doesnt work for you they work for the order book buyers. Robinhood will suspend orders for calls and outright longs.

The potential losses from demanding $5K a share are something like 400 billion which would require fed intervention.

Yes its entirely possible the ponzi financial system collapses if GME keeps printing higher. Remember subprime collapsed wallstreet in 2008 but that was a tiny % of actual lending.

No way will regulators allow this so expect freezes on buying followed by major lawsuits against the financial establishment.

Edit:

$5K GME makes posters on this subreddit some of the richest people on the planet.

Wallstreet banks may convince Gamestop to issue additional shares which would end this.",https://www.reddit.com/r/wallstreetbets/comments/l6wu92/5k_gme_is_a_potential_400500_billion_dollar_loss/,115,There is a possibility that the ponzi financial collapse if GME keep rpinting higher. Potentail loss from demanding 5000 dollars a share is like 400 billion. No regulator want this to happen and hence there will be freeze in buying the stocks.,62
Thank You...Yes I Mean You!,"I am sitting here reading your threads, tears running down my cheeks. Please bear with me, it is hard for me to put my thoughts and especially feelings into words. I see bonding and common struggle with open arms towards Boomers, Millennials, Left Leaning, Right Leaning, Race, Creed, Ethnicity. My world view has been shattered over the last few years. I am not an idiot, and while not quite a Boomer, I have been around the sun more than a few times. I always kept my head down, worked hard, tried to make a good living for myself and my family. In my business I always tried to do right by my employees and my customers. I am a capitalists', as in the idea of fair trade between free people. It's also why I am Libertarian, the less government involved in my life, the better in my opinion. I mention my Capitalism and Political beliefs because that is what has become blaringly obvious to the masses, the Elites of money & power are no longer even trying to pretend it's about making our lives easier. Sitting here reading your family stories about the '08 meltdown disasters has brought back so many emotions, as I remember losing my house, my wife and just trying to stay afloat because my young son needed me. So sitting here watching a movement, even if it does nothing more than wake the elites up and remind them that real power is the people, means more to me than any of you could possibly know, so THANK YOU for this! BTW that same son who I mentioned earlier, he texted me yesterday to tell me about this movement and that BB and NOK were next. I immediately bought both, not for the money, but to be part of something larger than myself and to support an ideal that transcends the petty BS of polarization of class and beliefs that the Elites have always used to distract and move us humans as if we are just cattle to be herded to the slaughter. However it turns out, I will hold my end of this. Thank you for listening to an old man rant and may all of you be blessed with love and happiness. Heading back to lurking now /BYE",https://www.reddit.com/r/wallstreetbets/comments/l6wu5a/thank_youyes_i_mean_you/,384," I see bonding and common struggle with open arms towards Boomers, Millennials, Left Leaning, Right Leaning, Race, Creed, Ethnicity. I mention my Capitalism and Political beliefs because that is what has become blaringly obvious to the masses, the Elites of money & power are no longer even trying to pretend it's about making our lives easier. Sitting here reading your family stories about the '08 meltdown disasters has brought back so many emotions, as I remember losing my house, my wife and just trying to stay afloat because my young son needed me. I immediately bought both, not for the money, but to be part of something larger than myself and to support an ideal that transcends the petty BS of polarization of class and beliefs that the Elites have always used to distract and move us humans as if we are just cattle to be herded to the slaughter.",86
Have you guys heard of GME?,"I'm pretty new to investing so I've been searching around for just the right stocks to start my portfolio with. Recently, I came across the stock with the ticker GME. From what I can tell, it's had great gains the last week or so even going up over 100%! Wow! I think this is just the kind of stock I've been looking for based on my own personal research! I can't speak for anybody else but I like this stock.",https://www.reddit.com/r/wallstreetbets/comments/l6wu4r/have_you_guys_heard_of_gme/,85,I am new to investing in the stocks and looking for the right stock to invest. I had researched about the the high growth and high return on GME. I loved this stock but will not speak on other behalf.,68
Current data on GME short positions,"Is there data on current short positions in GME?

With all the news of Melvin/Citron exiting their short position, I’m trying to find credible data proving or disproving this? All I have managed to find is Nasdaqs bi-monthly short position update, where the last data is from the 15th of January, much could have happened since.

If anyone can point me in the right direction that would be awesome. I think it is really important for everyone on here to have access to this data to time exits",https://www.reddit.com/r/wallstreetbets/comments/l6yxto/current_data_on_gme_short_positions/,91,I am finding the trustworthy data to verify news whether Melvin/Citron exited their short position or not. I managed to get information about Nasdaqs bi-monthly short position from 15th January. I need help from other to set me into right direction and it is crucial for everyone to have data to time exist,61
"We can win, and we will win.","This was done without any leadership. Any fucking form of leadership.

Do you understand the scale of this, from just that?

We are a collection of individuals, we are not following any single order, and we have made this happen.

&#x200B;

&#x200B;

Just imagine, imagine with me here...

We can, change the world.

&#x200B;

This is just the beginning. 

&#x200B;

The shady shit they are trying to pull back there, and we as individuals are pushing so fucking hard.

&#x200B;

We will prevail. 

&#x200B;

We can win, and we will win.",https://www.reddit.com/r/wallstreetbets/comments/l6yx7c/we_can_win_and_we_will_win/,91,"There was a lack in the leadership decision, and it needed to be a collective step instead of one's idea. There is a belief in the group that we can correct the decision and can prevail. The group is assured that they will win.",99
Support the team with CSPs ...... 03/19 $20p,"Thanks to the hyper-reflexivity of modern, Robinhood-fueled equity markets, GME is not going back below $20 for a loooong time.......if ever. However, thanks to 500+ % IV, you can sell the 03/19 $20 Put for $4. Thats right, you can get a 25% return in a month and a half and if it goes tits up, you get filled at the same price as our lord and savior Ryan Cohen ($16). 

Also long 10 shares but I want to support GME as much as I can (within my own personal risk tolerance of course). Arguably, the $1600 in collateral you will have to post is better spent on \~4 shares but if you want a sure thing, $400 for buying a 100 shares of GME at $16 in a month in a half is hard to beat.",https://www.reddit.com/r/wallstreetbets/comments/l6ywsj/support_the_team_with_csps_0319_20p/,140,"Robinhood-fueled equity markets, thanks to the hyper-reflexivity of modern market. GME is not going back below $20 for a long time. Arguably, the $1600 in collateral you will have to post is better spent on 4 dollar shares but if you want a sure thing, $400 for buying 100 shares of GME at $16 in a month in a half is hard to beat.",96
